|title|score|id|subreddit|url|comments|selftext|created
0|Trading Signals Are The Core Building Blocks Of Quantified Trading Systems With An Edge In Addition To The Watchlist And Position Sizing Parameters ✔️|3|r4eq8b|daytradingoptions|/r/StockBreakouts/comments/r4eozw/trading_signals_are_the_core_building_blocks_of/|0||1638134507.0
1|The First Thing A New Trader Should Be Told Is - The Goal Is To Trade WELL ✔️ Not OFTEN ❌ - Place Your QUALITY Of Trades Over Your QUANTITY Of Trades Because In Trading Less Is Actually MORE ‼️😎|15|r3z6ph|daytradingoptions|https://i.redd.it/2dvcytygla281.jpg|1||1638086246.0
2|What is Short squeeze and how to find the next one?|2|r3cd09|daytradingoptions|https://www.youtube.com/watch?v=Op5fcutkCQU|0||1638015082.0
3|Everything You need To Know About Dark Pools In The Stock Market|1|r2rb4i|daytradingoptions|https://youtube.com/watch?v=ehwTf_YGj3Y&feature=share|0||1637944717.0
4|🤫🤫🤫BE READY|2|r0rcnl|daytradingoptions|https://www.reddit.com/gallery/r0rcnl|0||1637712950.0
5|Long Term vs Short Term Investing|1|r0r0nv|daytradingoptions|https://youtube.com/watch?v=GiV93W48Tss&feature=share|0||1637712020.0
6|crypto|2|qydwev|daytradingoptions|https://www.reddit.com/r/daytradingoptions/comments/qydwev/crypto/|1|"The fastest way to make some money in Cryptocurrency day trading or trading

I am an absolute beginner but want to make some money while studying."|1637439717.0
7|How To Build Wealth With Good Credit|4|qxlxxb|daytradingoptions|https://youtube.com/watch?v=oxtDvCGk1U8&feature=share|1||1637345304.0
8|Stock Market Manipulation Tactics And How To Avoid Them|2|qw23cs|daytradingoptions|https://youtube.com/watch?v=AXMF0-iHAHo&feature=share|0||1637163969.0
9|Wash sale|3|qvljqu|daytradingoptions|https://www.reddit.com/r/daytradingoptions/comments/qvljqu/wash_sale/|0|"I'm confused about the wash sale rule. So in order to avoid wash sale and tax implications, a trader must liquidate the affected stocks and not trade them or similar investment instruments for 31 days.

With that said, can someone just purchase different stocks. Or you d have to not touch any stocks at all? I mean what other options are there?

Fiy: from my understanding, Nov 30 is the last day to liquidate affected stocks to avoid the wash sale tax implication for the upcoming tax season."|1637106216.0
10|Why Origin Materials Stock (ORGN) Will Explode 10X In The Near Future|4|qujeb9|daytradingoptions|https://youtube.com/watch?v=B2RyFIVDm1s&feature=share|0||1636991412.0
11|5 Best Metaverse Stocks To Buy Now|2|qrsolj|daytradingoptions|https://youtube.com/watch?v=_yja7kKwhHQ&feature=share|0||1636658185.0
12|7 De-SPAC Stocks To Buy Now|3|qpl560|daytradingoptions|https://youtube.com/watch?v=aislwXpUvyw&feature=share|0||1636399783.0
13|10 Common Investment Errors - Stocks - Bonds and Management|3|qngolj|daytradingoptions|https://youtube.com/watch?v=wGZG9Ru7fTk&feature=share|0||1636134878.0
14|The Best Value Stocks To Buy For Long Term|4|qiejuy|daytradingoptions|https://youtube.com/watch?v=JLeEbD4TwLk&feature=share|0||1635519075.0
15|How to research a company before investing in their stocks|2|qh0oxh|daytradingoptions|https://youtube.com/watch?v=-qwPzFC9Ntc&feature=share|0||1635352457.0
16|The 10 rules for successful tax free income investing|5|qfqh1o|daytradingoptions|https://youtube.com/watch?v=mAneCDPb5EU&feature=share|0||1635196144.0
17|Best stocks to buy for long term|3|qdj6ju|daytradingoptions|https://youtube.com/watch?v=A4-SI3Kv2TY&feature=share|0||1634916013.0
18|Coinbase Options Trading Strategy Profitable Again! This is the next move...|2|qd50k5|daytradingoptions|https://youtu.be/xEKkUWkKTlQ|0||1634861718.0
19|What Happens At Wall Street?|2|qc7usj|daytradingoptions|https://youtube.com/watch?v=3zClm3THapk&feature=share|0||1634755466.0
20|Free Trade Analysis, Options Strategy Training 10/23/21 Access to free buy/sell Algo!|1|qafd3b|daytradingoptions|http://www.discord.gg/M33hHyg8|0||1634531538.0
21|10 Mistakes To Avoid When Investing In The Stock Market|4|q8pp4q|daytradingoptions|https://youtube.com/watch?v=Qq4NnTMyJrA&feature=share|0||1634308394.0
22|My $AMC analysis that I did last night hit! I hope the market agrees with me tomorrow, lmk what you think|0|q8g815|daytradingoptions|https://youtu.be/vw4op5fLIJg|0||1634270515.0
23|How To Protect Your Investment From Stock Market Crash|0|q7cmhx|daytradingoptions|https://youtube.com/watch?v=Aes-IEdmisI&feature=share|0||1634136069.0
24|Palantir Lands $823 Million Big Army Contract - Everything You Need To K...|2|q2lbvi|daytradingoptions|https://youtube.com/watch?v=nx5qg7e-4ik&feature=share|0||1633529664.0
