|title|score|id|subreddit|url|comments|selftext|created
12|Hyperfine (HCAQ) Deep Dive taking off after merger. Portable MRI FDA approved|1|prqa2g|StockMarket|https://www.reddit.com/r/StockMarket/comments/prqa2g/hyperfine_hcaq_deep_dive_taking_off_after_merger/|2|"
Disclaimer: I have a small position in Hyperfine (HCAQ), and hope to add after the merger

Hyperfine a company that has developed the first portable MRI was founded by high profile serial med tech entrepreneur Dr. Jonathan Rothberg by way of the innovation incubator 4catalyzer. Dr. Rothberg has also brought Butterfly Networks (BFLY) and Quantum-Si (QSI) public as well through spac mergers. I love all three of these companies as well and have done dd on them and am invested.  
 
There are some similarities with Hyperfine and BFLY and QSI in that they leverage semiconductor technology to make processes more efficient. Butterfly Networks has some striking similarities to Hyperfine 
BFLY was the first SPAC to go public from Jonathan Rothberg, and is the most like Hyperfine. Butterfly Networks and Hyperfine are both disrupting existing industries and technologies. Butterfly and Hyperfine use semiconductor technology to miniaturize existing medical technology making it more portable, more efficient and at a lower cost. For butterfly, they have taken the ultrasound and shrunk it down to the size of an electric hand-held razor, and it is compatible with a cell phone (Cell phone screen or tablet acts as the monitor). It makes sense to first analyze Butterfly in terms of better understanding Hyperfine, as Butterfly is a more mature product and it provides insights into how Hypefine may market and develop their MRI. 
Butterfly is an incredible technology for several reasons. First, you increase the accessibility of the ultrasound, right you can have it in family practitioners' office. So, this is an example of increased accessibility, having the ultrasound where you would not before. In that sense there is no competition, you must educate potential customers about the benefits of having an ultrasound in alternative environments. This is something that Hyperfine must do, as they are seeking to redefine the use cases.  Like self-monitoring on an ultrasound that is a new use case. Literally, having an ultrasound at home and communicating using telehealth with a doctor that lives on another continent. You could have this on a cruise ship, or a remote military base, you get the idea, ultrasounds will be where they have not before. 
 	They also have an ultrasound designed for veterinarians use, legacy expensive ultrasound machines work very well, however they have very predictable downsides that can be exploited and the industry can be disrupted. The legacy Ultrasound is large, and not very mobile. It is expensive, and requires extensive training to read and interpret. Butterrly is small, inexpensive, and portable. They also have software and cloud storage that helps with transferring and storing your data. 
 So brilliant and an exciting business opportunity as they start to collect data store it in the cloud and in time use machine learning that can help decipher the scan 
As far as the business model, of course you have the hardware, but that is sold close to cost, it is the the cloud service subscription fee, which we all now as SAAS or software as a service. Investors love the margins associated with SAAS. Butterfly has executed well also, unlike many other SPACs.  
Hyperfine conceptually is quite like Butterfly Networks, however this time it is the MRI. Of course, it is not handheld we are talking about an MRI, but it still is small enough to fit into an elevator and can be plugged into a normal socket, meaning it can be moved around a hospital and most importantly moved into an ICU. Or be stored within the ICU. We will start to see some of the similarities, but it starts with an analysis of what limitations do the current models have.  
Let us start by analyzing the legacy MRI machine. MRI machines can cost upwards of a million dollars and could require several hundreds of thousands more when you include the MRI Suite which needs to be built due to the extreme magnetic field which is generated which can be 60,000 times the strength of earth’s own magnetic field. Economics teaches to always look at the tradeoffs of any decision. We of course have the opportunity cost associated with the excessive cost of the equipment, but we also do with the space that is needed to house an MRI machine. This is significant space that could be used for other revenue generating activities. 
Well needlessly to say, the costs associated with building an MRI suite and purchasing the machine, are high. This makes it cost prohibitive for many hospitals reducing access to MRIs to the public. Fewer hospitals will have one, so if you could imagine a medium sized town would only have one MRI machine, and having only one hospital that has only one machine is a market failure, because in effect it is a monopoly, monopolies reduce consumer surplus, imagine the hospital can charge as high of a rate as they would like, and you will pay since there is not an alternative.  
Hyperfine is just a 50,000 upfront cost, an enormous difference and a great competitive advantage that could potentially increase the number of facilities offering MRI imaging thus bringing down costs for the consumer through increased competition. For the hospital, they have lower capital costs freeing up cash that can be invested elsewhere. The quality of the imaging of the larger machine remains better now, but we are talking access when you did not have access before. It could mean the difference between you not getting an MRI and choosing to get one.  
Now we can look at one of the other major disadvantages, and this is the lack of portability of the traditional MRI machine. The traditional MRI needs to be placed in a secure environment requiring the transport of each patient to that room which is not close to the ICU given what the needs of the MRI suite. First you have the danger of moving a patient in a critical state, both in the time it takes to transport, and the transport itself. It has been reported that adverse effects can happen anywhere between 22-46 percent of patients associated with transporting them to the MRI. The time saving measure as well as the reduction of risk in eliminating the transportation of the patient is huge. 
Now we can talk about labor productivity everybody's favorite topic, I am obviously insincere, it’s nobody's favorite topic. Let us look at the workflow associated with traditional MRI compared to the Hyperfine. You have 25.8 hours from when deciding that the patient needs an MRI until that whole procedure including analysis is finished. With the Hyperfine you have that done in just 90 minutes. That is a staggering 94% reduction in time. Of course, that is great for the patient. But as far a hospital administrator, that means less staff needed, or you open time for that staff to be doing other revenue generating activities. I love all the connections this company makes to simple economic concepts. 
The Hyperfine has already sold over 50 units, and is cleared by the FDA, which is a huge hurdle that every investor is aware of. It also means it that it has been studied extensively. The most impactful study of Hyperfine was done by Yale Health which found the hyperfine to be effective in identifying hemorrhage that would be life threatening. The accuracy y of 80% was also lauded in the study. So, we do not have to talk about hypotheticals. We have Yale health which is an institution that is widely respected and held in high esteem, publishing research in a peer reviewed journal. This is not a commercial that claims 6 out of 10 dentists prefer this toothpaste, this is a legitimate study proving efficacy.  
What do we like to see when we see an innovation that is first to market? We want patents to protect that innovation, otherwise if successful and it generates revenue well above cost, then competitors will jump in and compete on price driving down margins. What do we have with Hyperfine, the first ever portable MRI. We have 99 issued patents with 285 pending. We need to lock up that technology to prevent others from jumping in the space. That is important in building a moat, and something I look for as an investor in investing in innovation.  
So, what does the future looks like for Hyperfine. Or at least their planned future. They have merged with Liminal sciences which is a bit of a speculative play but adds potential upside and fits into the Hyperfine product. Liminal sciences are attempting build a device that monitors vital signs in the brain using machine learning and AI to predict outcomes allowing doctors more access. It is important to mention it is a noninvasive approach. This to me is a throw into the deal it has potential upside but at this point is a bit of an unknown, they are hoping this comes online in 2023.  
Hyperfine hopes to finish production on a portable MRI that can be used on the spine and extremities by 2023 as well. This builds on existing technology and is a sure bet than the Liminal brain vital sign monitoring. They are also looking to develop guided intervention which includes robotics to assist with life-saving interventions surgery, and a breast MRI to detect breast cancer. For my investment thesis, I am only considering the portable MRI that currently exists and other iterations of it, as they have proof of concept of these. As far as the robotics and AI components that is a possibility that brings upside but is more speculative. The TAM is projected at 23 billion which is huge. That just gives you an idea of the market, obviously not sales, but that there is a need or a market to sell the product.  
The financials are not much to speak of now a prediction of 2.3 million in 2021. Rising to over 300 million in 2025. Current valuation comes in at under a billion at 956 million which I do not find terrible given how hot the market is. However, it is still expensive given the current projected sales. My own analysis I did not use the 300 million in 2025 to create a price target I trimmed that down to 280, as I did not want to include some of the more speculative plays like the AI brain sensing device, and surgical robots. That does not mean that they will not happen, but there is not proof of concept. Even at the lower projection using a 15 high multiple and a 10 low multiple I think that if the company can execute the stock should be worth between 37 and 44 by 2025. Discounting back to present value and adding in a margin of safety of 25%, currently the fair value is currently around $13 meaning that it is undervalued. If you want to see how I calculated this watch the video.  
It is a SPAC trading under 10 dollars before the merger. I expect a high redemption rate it could be as anywhere from 50 to 90 percent of shares here get redeemed, causing the stock to dip initially and then recovering witth a strong bounce. If this happens my valuations are not accurate as there is less cash for the company, and less shares outstanding. 
 In this case they have some money from the pipe, and fewer shares means a lower market cap which I hope for. I think they will still get the money that they need to inject into their business, and as an investor I will get a better valuation. Win win. So, I have bought a few shares, I hope to buy the day after the merger vote, where I anticipate a lot of redemptions and a significant drawdown. There is more information in the video if you want more depth  

https://www.youtube.com/watch?v=RJBtUDvMgYA"|1632124904.0
13|'Ghost kitchens' boom in Asia as new lockdowns rise with new wave of infections ($JK)|4|prfq8b|StockMarket|https://www.reddit.com/r/StockMarket/comments/prfq8b/ghost_kitchens_boom_in_asia_as_new_lockdowns_rise/|1|" The overwhelming demand for food delivery created by the COVID-19 pandemic has fueled the growth of ""ghost kitchens,"" restaurants without dining rooms that serve food strictly for delivery.

The US ghost kitchen industry has grown to at least 1,500 restaurants, according to research firm Euromonitor, and estimates the global market for ghost kitchens could surpass $1 trillion by 2030. Such companies successfully riding this trend include $GRUB $DASH $CMG $DENN $WMT $KR $CHUY $SBUX $DPZ $UBER $EAT $JK

I want to talk about one of many ghost kitchen giants in South- East Asia that have been on my radar, which have said to prospectively grow into new territories. Let's talk about JustKitchen.

JustKitchen ($JK, $JK.V, $JKHCF) is a Taiwanese based company founded in 2019, successfully listed in the Toronto Venture Exchange (TSXV) and OTC Markets. The company is primarily an operator of ghost kitchens specializing in the development and marketing of proprietary and delivery-only food brands for consumers. JustKitchen uses a hub-and-spoke operating model, combined with online and mobile application based food ordering carried out by third-party delivery companies like DoorDash ($DASH) and GrubHub ($GRUB).

Analyst Cooper foresees continued growth for JustKitchen, with an expectation of $12.7 million in revenue for 2021, followed by a 193 per cent potential year-over-year increase to $37.2 million for 2022, followed by a potential 48.4 per cent year-over-year jump to $55.2 million for 2023. Below is a link for more info.

[https://www.cantechletter.com/2021/09/justkitchen-has-a-recipe-for-success-beacon-says/#](https://www.cantechletter.com/2021/09/justkitchen-has-a-recipe-for-success-beacon-says/#)

Listed are their highlights:

* Food and beverage sales of $3,346,897 for the three-month period ended June 30, 2021 compared to $479,664 for the three-month period ended June 30, 2020; similarly, sales reached $7,482,348 for the nine-month period ended June 30, 2021 compared to $712,801 reported for the 217-day period from November 27, 2019 to June 30, 2020
* Approximate sales volume grew to 214,744 retail customer food orders in the third quarter from 128,400 retail customer food orders in second quarter of 2021, which is an increase of 67%;
* Opened a new ghost kitchen location in Taoyuan, Taiwan;
* Launched two new delivery-only offerings including the TGI Fridays Go Burgers Collection and the Cali Vibe proprietary bento food brand;
* Entered into an agreement to collaborate in the Hong Kong market with Foodpanda, which is the dominant customer food order fulfilment platform in the region and a global online food and grocery delivery brand owned by Berlin-based Delivery Hero;
* Signed a Hong Kong-focused collaborative agreement with Zeek, which provides smart logistics with integrated on-demand delivery services for Hong Kong and Southeast Asia;
* Launched multiple delivery-only desserts in association with Paul Café, the global chain of bakeries and cafés with operations in 47 countries that was founded in France in 1889;
* Acquired the virtual branding rights to the Hutong Yakiniku brand from GYEN Intl Business Co., Ltd., which is one of the best Japanese barbecue cuisine offerings in Taiwan and has rapidly become a well-known name both locally and abroad with 11 restaurants in Taiwan, 11 in China and one in Hong Kong;
* Acquired the virtual branding rights to the local Taiwanese Ice Monster brand, which is a popular shaved ice dessert shop that successfully expanded to Japan and China in 2015 and Hawaii in 2017;
* Hired Michael Liu as its Executive Vice President of Operations, who prior to his current role with JustKitchen was the Head of Commercial for Deliveroo in Taiwan since 2019, which involved leading a commercial team of over 40 professionals connected to a portfolio of over 5,000 restaurant partners
* Warren Tseng appeared as an industry panelist as part of a session entitled ""The Ghost Kitchen Tech Stack"" during The Spoon's Restaurant Tech Summit on August 17, 2021
* Temporarily operated ghost kitchen locations between the months of June and August within the underutilized Marriott Courtyard Taipei Downtown and Madison Taipei hotels.

Now, as infection rates are climbing around the world, governments are imposing new restrictions due to the new wave of the delta variant. This means high demand for food delivery, which in turn is a golden opportunity for the ghost kitchen industry to grow exponentially. I'm no financial advisor, but I can assume we’ll see a spike in stock value for many of these companies in this sector.

Personally I think this is a great investment potential, especially at it’s dips. JustKitchen’s stock already has a good buy rating, and a TP of 3.40 as shown on MarketScreener. IMO, buying one of the dips around 1.60 and holding till 3.40 looks like a great investment, and who knows how much the value could rise (higher than TP). Hope you all enjoyed my DD, let me know what you guys think. And of course do your own DD. Cheers.

https://preview.redd.it/uhz6ho0crio71.png?width=2142&format=png&auto=webp&s=2a6c22bdfa43d67792e9fa499df1d2c6968a0ef7"|1632083072.0
14|Impending Doom?|8|prfog4|StockMarket|https://www.reddit.com/r/StockMarket/comments/prfog4/impending_doom/|53|"I have been looking and thinking very hard of a couple of catalysts which I fear could be catastrophic on the markets. It also seems mainstream media is not really digging into it very much and almost treating these two things as a passing storm...

Supply Chain shortages

The entire global supply chain is pretty much on its knees. Until a couple of weeks ago it was a lot about the container and shipping shortages, but the repercussions of raw materials and the impact on earnings across many industries is inevitable. I think it is hitting retail initially, moving on to manufacturing and other needed commodities, which will eventually hit top line and bottom line very hard in the upcoming few earnings. If you have nothing to sell, there is nothing to buy, means less income and the need to lower costs. The shipping industry is the blood veins of global trade, and with this completely blocked for what i perceive to be indefinitely, is going to be huge issue coming out of Q3 + Q4.

Evergrande default in China

Many people are wondering how this could affect Europe and North America. Well its simple in terms of the second biggest property developer in china (who have hundreds of assets bought at over inflated prices) will eventually leave most of its investors and creditors out of pocket for billions of dollars. The sub suppliers, employees and many others attached to this company will not be able to sustain the losses and potentially go bankrupt themselves.

Many ""wealthy"" Chinese have investments outside of china and have been paying over inflated prices driving real estate up in many countries around the world (Canada as an example), and how to recoup their losses or pay off debt to avoid bankruptcy? Well maybe one quick way would be to reduce exposure in other countries to get hold of cash out quickly.

Am I overthinking this, just want hear others thoughts..... have a nice Sunday!"|1632082922.0
15|Keep it simple|9|praqkg|StockMarket|https://www.reddit.com/r/StockMarket/comments/praqkg/keep_it_simple/|9|"Compound Interest is incredible. 

I saved my first 10k and started investing 4 years ago, at 25 years old. I speed ran that up to 94k up until about 5 months ago, when it all fell apart. I turned that 94k into 45k in 3 months with highly leveraged bets gone wrong. I was pissed for about a month, all I could think about. But you know what 45k compounded at 30 years at 10% is? 800k

That’s without a single penny of additional contribution, my monthly income exceeds my monthly spending by about 250, so even investing just half of that back into the market is 1,040,000 with all the rest of the assumptions the same.

I’m at 53k now in that account, and back to a cash only account.  27k IRA and 401k funds(not included in post). 31k I’m house principal paid off. Still over 100k in total assets. While by no means am I made for life, At 29 years old I can live a comfortable lifestyle, all because I started early.

Though I came to this realization a few months too late, wealth accumulation is very simple. Start early, Make more than you spend, invest it, and enjoy your life. Unfortunately the most important part is that first part, but people often don’t realize it until their 30s it seems."|1632067482.0
16|U.S. Homeland Security Signs $1.36M Contract with Coinbase|60|pr0whr|StockMarket|https://www.newsbreak.com/news/2376240981302/u-s-homeland-security-signs-1-36m-contract-with-coinbase|22||1632024055.0
17|$SUNL|5|prbe8s|StockMarket|https://www.reddit.com/r/StockMarket/comments/prbe8s/sunl/|1|"$SUNL - When fundamentals, TA, and short interest all point in 1 direction, up.

$SUNL presents a great opportunity for fundamental, momentum, and squeeze investors alike. They finance solar panels, and count Tesla as a customer - yes, the golden child of WSB. I could tell you about what I think about the company, and possible upside - but id rather present the facts and let you guys use this as you will.

&#x200B;

This is a recent de-spac, and I believe it to be unfairly punished due to the spac deterioration over the last 6 months.

&#x200B;

Here is some surface level summary via Simply WallSt :

[https:\/\/simplywall.st\/stocks\/us\/diversified-financials\/nyse-sunl\/sunlight-financial-holdings#about](https://preview.redd.it/hol8tkkm7ho71.png?width=1678&format=png&auto=webp&s=aac5730857913ca3a2c583945efa2ff1c4e3637c)

Now lets look at estimates. Per Simply WallST the far value is over 2x todays price. With most PT's ranging from 12$ - $14.

[https:\/\/simplywall.st\/stocks\/us\/diversified-financials\/nyse-sunl\/sunlight-financial-holdings#about](https://preview.redd.it/yk41dk3n7ho71.png?width=1692&format=png&auto=webp&s=f0b52e8039659ff038758084f61ceba78b7384ad)

&#x200B;

Some interesting info regarding institutional ownership. As you can see, many of the top investors loaded the truck at these discount prices:

[https:\/\/app.tikr.com\/stock\/ownership?st=shareholders&cid=311552575&tid=1673675405&ref=mb8ph5](https://preview.redd.it/renn5jtp7ho71.png?width=1926&format=png&auto=webp&s=d7d661019c8e78e8d2bd6653a4a9a86d8b47adf6)

[https:\/\/app.tikr.com\/stock\/ownership?st=shareholders&cid=311552575&tid=1673675405&ref=mb8ph5](https://preview.redd.it/87bcwngo7ho71.png?width=1938&format=png&auto=webp&s=c4227b7f7cab1f9ac05783375f643eebdb69a3d8)

&#x200B;

Might as well check on growth estimates, right? Break out the skis, because we have a big-ass slope! They plan to grow exponentially.

&#x200B;

[https:\/\/simplywall.st\/stocks\/us\/diversified-financials\/nyse-sunl\/sunlight-financial-holdings#about](https://preview.redd.it/lh7enb3o7ho71.png?width=1678&format=png&auto=webp&s=7f74a40aff8e15dfdfc2b9ff76e06826f08d77ba)

Beautiful balance sheet:

&#x200B;

[https:\/\/simplywall.st\/stocks\/us\/diversified-financials\/nyse-sunl\/sunlight-financial-holdings#about](https://preview.redd.it/kochhr0m7ho71.png?width=1720&format=png&auto=webp&s=1ab3fded4c315062593cea14c9d18094bbf146aa)

Oh yeah, did I mention that execs (CFO, COO, & CEO) bought a combined 170,000 shares in the last few weeks. 

&#x200B;

[http:\/\/www.openinsider.com\/search?q=sunl](https://preview.redd.it/ncmvynuk7ho71.png?width=2296&format=png&auto=webp&s=c7e15548235caec8004556d36df98b5b55947b83)

Sexy gap up to about $7.50, MACD looking good, momentum/volume building.

&#x200B;

[https:\/\/stockcharts.com\/h-sc\/ui?s=SUNL](https://preview.redd.it/ildn5csi7ho71.png?width=2130&format=png&auto=webp&s=eda8e0b51f29ead7e85718b7857bf4126c3a91c2)

IV (Implied Volatility) shot up last week, with only a small price jump. Yellow bars denote call volume, blue puts. As you can see the volume is almost completely bullish. I believe this bodes well for us.

&#x200B;

Via Market Chameleon (can’t post link).

Now we get to the interesting part. Ortex, as well as Finviz (pictured below) shows that it has 40%+ short float, but other sources say its closer to 11. I believe it is 11, but at the end of the day it has little affect. If the short interest is low, price should move up to close gap. If short interest is high, then eventually true fair value will be found.

[https:\/\/finviz.com\/quote.ashx?t=SUNL](https://preview.redd.it/cvrhhz59aho71.png?width=1662&format=png&auto=webp&s=ae42d0e8fa38980b3776b3d7f076300101590554)

&#x200B;

I believe we are moving towards a leg up sooner than later + this is picking up steam on financial - twitter.

&#x200B;

Bull and Bear opinions welcome, would love some info if you have any!

EDIT: Ortex - https://www.reddit.com/r/BreakoutStocks/comments/pqo6vf/sunl_ortex_data/?utm_source=share&utm_medium=ios_app&utm_name=iossmf"|1632069517.0
18|Fam, screenshots from Fintel showing $SDC short sellers stuck in losing positions from the 16th and prior after Friday's run up.🤤😂 Huge Retail interest still for the stock meaning more buying pressure which shorts don't like.😂 Treat as swing trade. You're welcome.|0|prgp0k|StockMarket|https://www.reddit.com/gallery/prgp0k|2||1632086162.0
19|$LIFE is staying on my watchlist after printing this daily flag consolidating, I will keep a close watch tomorrow for a push to 11.50, 12, and 13.|1|prkb5y|StockMarket|https://i.redd.it/3fl3ah333ko71.png|3||1632099121.0
