|title|score|id|subreddit|url|comments|selftext|created
0|BIG Correction INCOMING!?! 🤯|330|prllde|StockMarket|https://i.redd.it/ienatb0rhko71.jpg|140||1632104043.0
1|Investing is a long term game. Whilst we won't become rich overnight if we think in decades it can certainly help us to retire early and achieve time and financial freedom|3619|pr5j17|StockMarket|https://i.redd.it/5z72k1lqtfo71.jpg|145||1632047541.0
2|Bitcoin vs Gold vs S&P500|186|prdeqb|StockMarket|https://i.redd.it/ouilgq5u5io71.jpg|60||1632075824.0
3|John Oliver episode I watched tonight(july ep)|548|pr56cj|StockMarket|https://i.redd.it/wu19voteofo71.jpg|74||1632045749.0
4|Teetering property developer Evergrande sparks contagion fears for China's economy. Company with $300 billion US debt load poised to miss key interest payment Monday|26|prky03|StockMarket|https://www.reddit.com/r/StockMarket/comments/prky03/teetering_property_developer_evergrande_sparks/|13|"Property developer China Evergrande Group is teetering on the brink of collapse, weighed down by a giant debt load and billions of dollars in real estate it can't sell as quickly or as profitably as anticipated.

While trouble has been brewing for a year, it's coming to a head now, as the conglomerate missed one loan payment in June and more are expected. Evergrande's offices were the site of angry protests this week, and things could get even uglier on Monday when the company is likely to miss another key interest payment to its increasingly concerned financiers.

Evergrande's possible collapse is sparking fears that it could take other parts of China's housing market down with it — and impact business interests outside China, too.

## What is Evergrande?

Founded in 1996 in the Chinese city of Shenzhen, across the border from Hong Kong, Evergrande is mostly a property developer whose core business is buying up land and turning it into residential real estate. Company founder Hui Ka Yan is a former steel worker who rode China's 21st-century real estate boom to a fortune that was at one point last year worth $30 billion US, good enough for the title of third-richest man in China. 

The company has built more than 1,300 housing developments in 280 cities in China, with plans for another 3,000 projects underway in various cities across the country.

But like any good conglomerate, it has expanded into all sort of other businesses, including [bottled water and food](https://mobilesite.evergrande.com/en/business.aspx?tags=16), electric vehicles, theme parks, a Netflix-like streaming service with almost 40 million customers — and even a [professional soccer team](https://gzfc.evergrande.com/english/about.aspx).

## Why is it in trouble?

>Debt — and lots of it. The company has almost two trillion yuan of debt on its books, the equivalent of more than $300 billion US. The company aggressively borrowed money to buy more land to develop, and sold apartments quickly at low margins to raise enough cash to start the cycle again — which works fine as a business model, until it doesn't.

In late 2020, new rules that brought more scrutiny to the company's finances revealed higher-than-expected debt loads. That, coupled with mounting construction delays, spooked buyers, setting up a vicious cycle. The company began its descent to pariah status as lenders and buyers lost their nerve in lockstep with each other.

Every attempt by Evergrande since then to distract from its problems only served to draw more attention to them. Lenders became more and more unsettled. Existing owners got upset. New sales slowed, which created a feedback loop that got lenders even more jittery.

## What could happen?

A number of bleak B words are on the table — bankruptcy, breakup, buyout or bailout — and none of them are ideal.

## Is there an impact outside China?

Not much, directly, although Evergrande does have assets in Europe and North America — [including the ritzy Château Montebello resort in Quebec](https://www.cbc.ca/news/canada/ottawa/ch%C3%A2teau-montebello-resort-bought-by-chinese-real-estate-group-1.2878002) — but the company's woes are nonetheless a cautionary tale for people everywhere.

&#x200B;

Full Article:   [https://www.cbc.ca/news/business/china-evergrande-explainer-1.6179508](https://www.cbc.ca/news/business/china-evergrande-explainer-1.6179508)"|1632101552.0
5|The Man Who Lost $20 Billion: Bill Hwang from Archegos?|28|prk8wr|StockMarket|https://www.reddit.com/r/StockMarket/comments/prk8wr/the_man_who_lost_20_billion_bill_hwang_from/|7|"The Man Who Lost $20 Billion in Two Days Is Lying Low in New Jersey

About 15 miles from midtown Manhattan, the head of Archegos is groping for answers in the wake of one of the biggest debacles in Wall Street history.

He sits on the porch in a white plastic chair, a swing set out back, the lawn freshly mowed.

Here in suburban Tenafly, 15 miles from midtown Manhattan, few would guess that this unassuming figure is none other than Bill Hwang — the man who just lost more than $20 billion.

“Billion with a B?” gasps a neighbor down the block, when told of the epic blowup at Hwang’s Archegos Capital Management.

Yes, billion, with a B, as shocked lenders can attest. Four months after Archegos rocked global finance, bankers and federal authorities are still sifting through the wreckage. The liquidator who mopped up after Lehman Brothers has now come for Archegos. Some colleagues have turned on Hwang; others hope he’ll bankroll hedge funds that might yet rise from the ashes.

U.S. prosecutors are asking questions, too, including the big one: Was all of this another spectacle of Wall Street greed and hubris, or was it something worse? Credit Suisse Group AG, staggered by a $5.5 billion blow, says it was likely deceived by Hwang’s family office.

Hwang is groping for answers of his own. He amassed one of the world’s great fortunes in virtual secrecy — and then lost it, very publicly, in a blink. In the easeful heat of this summer morning, he’s awaiting a call with a retired U.S. general who, he hopes, might provide some counsel. He’s dressed like your average American soccer dad: teal shirt, blue cargo pants, Adidas slides. He has a pad of paper and a pen handy. An 8-ounce plastic bottle of Poland Spring water stands on the white plastic table which, like the chair, could have come from Costco.

At hand, too, is a Christian pamphlet — a testament to the faith that’s guided Hwang as he made dangerous bets in the markets and was even charged with insider trading in the past. The title is Armor of God, a reference to Ephesians 6:11 — “Put on the full armor of God, so that you can take your stand against the devil’s schemes.”

Hwang is relaxed, self-deprecating and reflective in a brief conversation, but declines to discuss the Archegos fiasco or his next steps. He’s been lying low here in New Jersey, in this tidy borough of 15,000, beyond The Palisades cliffs that rise above the Hudson River. He is not exactly a Wall Street Napoleon exiled to Elba: Hwang has lived here for years, in the same house, with cobwebs in the eaves and hedges out front. A Mercedes sits in the driveway. “Black Lives Matter” signs dot neighbors’ manicured lawns. Homes on this tree-softened street tend to sell for a few million dollars — a modest price, for a billionaire.

It’s difficult to square Hwang’s mostly unglamorous life here with the portrait of him that has emerged over the past few months. By all accounts he eschews the trappings of extravagant wealth. At the Tenafly Classic Diner, where the “NJ Sandwich” goes for $6.95, the servers say he’s been known to stop by, but haven’t seen him lately. More recently he’s been chauffeuring his family around town, in between coping with one of the biggest debacles in Wall Street history.

Credit Suisse provided the first official peek into the flameout. A 172-page autopsy, released publicly on July 29, exposed a litany of management failures at Credit Suisse. But the embattled lender also says “it seems likely that Archegos deceived CS and obfuscated the true extent of its positions, which Archegos amassed in the midst of an unprecedented global pandemic.”

This account also hints at a shift in Hwang’s strategy that has baffled outsiders. Archegos had grown rapidly by making huge bets on established FAANG stocks — blue-chip U.S. technology companies. But by last year, it was plowing money into risker bets like ViacomCBS and several U.S.-listed Chinese stocks, some of which had been targeted by short sellers.

When the banks began dumping Hwang’s portfolio, these shares tumbled. And a more recent crackdown by the Chinese government has further decimated many of Hwang’s favored bets.

For Hwang’s family office, now comes the inevitable: liquidation. Only months ago, it boasted holdings — built on borrowed money — valued at more than $120 billion. Today, everyone is lining up for the scraps.

The person handling the liquidation is David Pauker, the specialist who stepped in after Lehman failed during the 2008 financial crisis. More recently Pauker worked on the restructuring of Steinhoff International Holdings, the South African furniture retailer that nearly collapsed after an accounting scandal in 2017. He declined to comment on pending matters.

Across the river from Tenafly, at Hwang’s midtown Manhattan office, his landlord is suing Archegos for unpaid rent. Like building owners citywide, real-estate giant Vornado Realty Trust — run by billionaire Steven Roth — has been stung by the pandemic. It’s trying to recoup $159,165.55 from Archegos.

Hwang’s 38th-floor offices in the building across from Carnegie Hall have mostly been emptied, and his Christian charity, the Grace and Mercy Foundation, has decamped to a cheaper 22nd floor in the same building. The foundation had more than $600 million in assets as of 2019, according to its most recent tax filings. It had even more money in early 2021, according to a person familiar with the matter.

The size of Bill Hwang’s fortune remains uncertain. Former employees have been grousing that while they’ve been wiped out, Hwang, through private investments and other holdings away from Archegos, could still be a billionaire.

One such investment was the seed money he poured into four of Cathie Wood’s exchange traded funds that have exploded in popularity thanks to their market-beating returns.

Banks are haggling with Hwang’s team to figure out the size of his remaining wealth and whether they can claw back any of it. Credit Suisse has said it will seek to recoup money from Archegos and its related entities and individuals. The Swiss bank also flagged in its findings that Hwang’s firm took out more than $2 billion in excess margin from its account with the lender in the days before the collapse.

The Department of Justice has been moving ahead with a probe into the blowup. At least one line of questioning has revolved around the communication between Hwang’s top associate Andy Mills and the lenders, and whether he may have misled them in the week of the crash, according to a person interviewed by prosecutors.

“The assertion that Andy Mills or anyone at Archegos misled the banks during the week of March 22 is untrue in every respect,” a spokesman for Archegos said.

The Archegos debacle has fractured ties between Hwang and some former colleagues, who are fighting to recoup deferred compensation that was tied up with the firm. Part of their annual bonuses — which amounted to about $50 million — was invested alongside Hwang and rocketed in value with his portfolio, people familiar with the matter said. They want Hwang to carve out cash from money he may have set aside elsewhere.

One of Archegos’s employees has put his home in Manhattan and another on Long Island up for sale, according to real-estate listings.

Despite everything, Hwang is trying to push forward. He’s investing his remaining money, and occasionally crossing the Hudson to catch dinner at a New York restaurant. He spends spare hours as he has for much of his adult life: praying, reading Christian-themed literature, and listening to recordings of the Bible. He’s recently been reading “The Screwtape Letters” by C.S. Lewis, looking for guidance to navigating the current troubles. A satirical epistolary novel, the book features the demon Screwtape writing letters of advice to his nephew, Wormwood, who is trying to win the soul of a young man.

Others are trying to move on too. Hwang has promised to throw his weight, if not his money, behind at least three funds being launched by protégés. Hwang named his firm Archegos, an ancient Greek word for leader or author, a reference to Jesus. The names of two of the new funds reflect the cataclysm at Archegos. One is Red Ember Capital and the other is AriseN Partners."|1632098889.0
6|Jeff Bezos hinted that Amazon was overvalued during the dot com bubble.|23|pri9in|StockMarket|https://www.youtube.com/watch?v=OOmsLlZPaxA|4||1632091453.0
7|No China bailouts and big volatility shock in US markets?|20|prhrsv|StockMarket|https://www.reddit.com/r/StockMarket/comments/prhrsv/no_china_bailouts_and_big_volatility_shock_in_us/|2|" 

Been reading through some really interesting thoughts on Twitter posted in previous threads about Evergrande. If these guys turn out to have a point, this would all seem to be coming together.

First let me disclaimer with I've not fact checked this. I assume these guys know a lot more than me  I'm posting it here to let others know, offer my simplified TLDR of the main points and if anyone wants to post counter-arguments to their points you're welcome to.

**Concept One**

[Girolamo Pandolfi da Casio ditto Carlo Dossi Erba on Twitter: ""Evergrande: why most analysis is dead in water and how best to understand and navigate what’s happening? Both denialists and alarmists are getting it wrong. Let’s start by understanding this: what is happening is the result of a CCP-initiated policy change to curb leverage. 1/N"" / Twitter](https://mobile.twitter.com/INArteCarloDoss/status/1438944431734919175?s=19)

There'll be no bail outs. What's happening in China is not an ""Oops"". The Chinese RE market has been subject to all sorts of fuckery going on on it for a long time and has become a large percentage of the GDP. Companies like Evergrande are on the verge of going bust even although they're not reported a single loss, ever. This is because losses have been hidden on balance sheets as assets in the form the properties - but these properties can not be sold, in reality these companies hold nothing but liabilities.

The CCP have noticed this and they've set out rules to stop this for becoming an uncontrollable explosion somewhere down the line. Dictated leverage caps and various other things that are going to curb the growth of this industry (Stop the bubble). This is not Lehmen-esk in that a surprise happened and the question becomes what will the response be - this is a result of something the CCP has already done.

China can not and will not bail out Evergrande because it has recognised that an uncontrollable bust will come later down the line if they do not engineer a controlled one now. China may backstop housing prices to prevent losses to investors, but they will let the overleveraged and under-capitalised companies fail. Allowing for a strong base to be left of those who succeed.

**Concept 2**

[TheLastBearStanding on Twitter: ""🚨🚨 China Credit - Writing on the Wall - and How to Trade It. (9/15/21)👇👇"" / Twitter](https://mobile.twitter.com/TheLastBearSta1/status/1438171695685283847)

This thing of having on-paper ""Assets"" of trillions of dollars that are really worthless is not contained to Evergrande. It's a broad issues across the Chinese market. The Chinese market is hugely overleveraged and all of the perceived value of the industry is mainly down to sly tricks and creative accounting - not real growth, and certainly not functional demand. Most of the properties are empty.

What we're seeing in Evergrane now is just a glimpse into what we're due to see in other RE companies.

**Concept 3**

[TheLastBearStanding on Twitter: ""🚨🚨 Equities, Options Gravity, and Volatility: The Fragile Market Hypothesis 🚨🚨👇👇 (Aka one doofus's overly simplistic attempt to explain lurking risk in the market with stick figures and clip art. If you're invested, you should read)"" / Twitter](https://mobile.twitter.com/TheLastBearSta1/status/1424833306781159433)

An event like this in China can create a volatility shock in US markets. Causing prices to move faster, faster moving prices causing more hedging against deep OTM put options and this having a self-reinforcing effect causing capitulation risk in the US markets. This sequence of events would build up to a Black Swan event."|1632089700.0
8|$ATER TECHNICAL STRATEGY FOR WEEK 9-20|8|prkm8m|StockMarket|https://www.reddit.com/r/StockMarket/comments/prkm8m/ater_technical_strategy_for_week_920/|3|"This is my strategy for $ATER going into the week.

[9\/20 WEEK PLAN](https://preview.redd.it/dore8mn96ko71.png?width=1680&format=png&auto=webp&s=dec1301b54976b85c8a19505b28bbc69168872c9)

Here are the strengths that supports this plan:

1. Support at 9.00 – 9.14 held beautifully with a **RETEST**
2. EMA10 was RECLAIMED, which $ATER has **RESPECTED EMA10 SINCE 8/31**
3. **Rebound off EMA21 with Oops Reversal** (buyers bought back in after realizing they’re stops were hit BELOW EMA10, touched EMA21 for shake out)
4. **Bullish outside bar** that covers **2 prior candles**

**I SAID BEFORE THAT REPSPECTING EMA10** **IS A SIGN OF A MOTHER STOCK.** **THE BEHAVIOR EXHIBITED ABOVE IS WHAT A MONSTER STOCK DOES !!**

Bears printed a MOTHER BAR that, once broken, will trigger the next MONSTER RUN. After the resistance is broken, the next target is the all time high (ATH) at 19.10 which is not too extended for Bulls to take out. Volume has been acting well and there has been more accumulation volume than distribution. Volume also increased on bull runs and dries up on the pullback (a sign of consolidation). Holders not selling, which can be seen by below average volume.

Let review what MOTHER BARS are and why they are important:

**Mother bars** are candles with a wide range and above average volume. Above average volume is needed to ""strengthen"" the move. The wider the range, the more difficult to break the highs and lows.

Shorts must break the lows to signal those waiting on the sidelines that price will drop and the momentum from **""new shorts"" entering the trade** will decrease the price.

Likewise, a break above the highs of these bars is a signal for **""new bulls"" waiting to enter** and those entering the trade will drive momentum and price upwards.

The closer the targets, whether long or short, the **easier the momentum** for price to go in a direction.

As always, we want to **check continuity**, which both the monthly and weekly shows being **upward**:

[MONTHLY CONTINUITY](https://preview.redd.it/2cw0nyzc6ko71.png?width=1680&format=png&auto=webp&s=179a10507053d9ac784d9da95e950bbe20a367c7)

[WEEKLY CONTINUITY](https://preview.redd.it/lh9zcazd6ko71.png?width=1680&format=png&auto=webp&s=d6dcc4d8f238acbd076e7f4533ab3da7cdc7bc4b)

What I’ll be watching for is the break of the mother bar for **HUGE** momentum. Again, there are strengths that support this move:

1. **Support was confirmed**
2. **EMA10 was reclaimed**
3. **Respect EMA10 is a monster characteristic**, which $ATER has shown since 08/31
4. **Bullish outside bar** printed after the **inside bar (indecision)** shows that direction is **UP**
5. **Oops Reversal below EMA10 and rebound off EMA21**

[SUPPORT](https://preview.redd.it/z56xc4sf6ko71.png?width=1680&format=png&auto=webp&s=a7a16c81897797e50ad4a14ed7026b345d8b2a96)

[OOPS REVERSAL](https://preview.redd.it/ae4ulcjg6ko71.png?width=1680&format=png&auto=webp&s=6468b1c947c75c539515720f52d84b7449a3c0d0)

Remember that breaking the high of the prior bar will signal **“new bulls”** to enter.  Nevertheless, we have to think in terms of **probabilities and examine risks**. Will the support be tested again? Maybe…But there is evidence indicating a low likelihood:

1. Shorts are **fighting against continuity**
2. The pullback to 9.14 could not break consolidation **support** 9.00.
3. There was a dry up volume and below average volume, which shows players are **not willing to sell**.
4. **Support was tested** and the day finished a **bullish outside bar** that closed above the prior high.
5. There an expectation with continued uptrend with **Oops Reversal**

Shorts / profit takers have to remember that an attempt at break support and EMA10 had **ALREADY FAILED**. What is the likelihood of success the 2nd try? The 1st attempted ended in an outside bar closing above the prior high. This **outside bar has a bigger range** as well, **covering both candles.** Holders are not selling neither (shown by the low volume) so where will the short momentum come from?

All signs point to Bulls having the advantage.

Let’s take a look at targets. It will not be an easy task for bulls neither b/c volume is needed to break the Bear Mother Bar. Will volume show? The **continuity is UP**. There is a potential as there are signs of **strength**. Past volume has been monstrous. If volume does show, the targets are:

1. Last candle high 11.97 will be a signal for “new bulls” to enter the trade and momentum will build.
2. Bear mother bar high 16.68 is next.
3. Last week’s high 19.10 is very close.
4. 21.07 is last month’s high.

[9\/20 WEEK PLAN](https://preview.redd.it/fc2rhqqi6ko71.png?width=1680&format=png&auto=webp&s=a2aa8bf84fb25ef4c949155e6c1455fb291a6c75)

Breaking the highs of longer timeframes are stronger signals as they are typically harder to break. Why? Longer timeframes reduces volatility and shows the trend direction. Thus, **breaking a high on a longer timeframe triggers a stronger signal because it validates the trend.**

Notice that 22.19 is both a prior weekly and monthly high. Taking out 2 highs in 1 break will trigger a MASSIVE run. How big? We will have to see!

Also, I get a lot of question about indicators. There is not one indicator that will predict movement. ALL INDICATORS ARE LAGGING. Indicators have information only AFTER a move is complete. This is why it’s so important to examine the behavior of a stock and think in terms of probabilities.

**APPLY THE TECHNIQUE DISCUSSED !!**

We know that continuity is up and the bear mother bar high will be broken (yes, will be, shorts / profit takers already failed).  Break the daily chart down to timeframes you feel comfortable, which I'm using the 30min.  This way, you'll be able to see the different levels going into this.

[30 MIN](https://preview.redd.it/1t3ak87k6ko71.png?width=1680&format=png&auto=webp&s=ac36241b62d56c0d0fa6cd9737d7a20d78a6623d)

STUDY, DO YOUR HOMEWORK, AND STUDY SOME MORE !!

Hope this helps! GLTA !"|1632100292.0
