|title|score|id|subreddit|url|comments|selftext|created
20|TQQQ 3X Leveraged Nasdaq question|7|pr8onm|StockMarket|https://www.reddit.com/r/StockMarket/comments/pr8onm/tqqq_3x_leveraged_nasdaq_question/|15|"Dear fellow investors.
A few years ago I stumbled upon TQQQ. Seeing the massive returns it was having, I digged and studied the subject, doing quite a good amount of DD on it.

My conclusione were essentally 3:
1) TQQQ returns aren't real as it gets rebalanced daily and doesnt work as long term investment. 

2) If the market falls 33%, you get wiped out. This kind of Crash already happened three times in the last 20 years.

3) People on some websites and forum were saying that, cause losses weight much more than gains, it was virtually impossible to make money with TQQQ.

Therefor, I decided to do not invest in it.

However lately I keep seeing youtubers, people and twitter and Reddit pointing out how amazing this etf is, that it has averaged a 55% return since 2010 and that they do not understand why people do not go all in on it.

They say that
1) Returns are real. If you invested 1000 dollars in 2010 they would be worth 86.000 today.

2) You cant get wiped out as market never crashes 33% in a day cause it gets halted, and if it Fall 33% overall you do not get wiped out as loses compound inversely as gains.

3) Invest in TQQQ is much better and profitable than ANY stock picking, etf or strategy on the market.

Where is the truth? I do not understand.

Anyone invested in it for like 3-5 years and can report their experience? Thank you"|1632060769.0
21|RXRX had prior support turned resistance and now we are coming back to that resistance again 29.50 area, just reclaimed 20 SMA will watch for the follow-through move and push over 29.50 and 37.00|0|prk132|StockMarket|https://i.redd.it/8qc3vzdvzjo71.png|0||1632098050.0
22|$DMAC Oppenheimer Summit Mon-Wed😃|0|prj525|StockMarket|https://i.redd.it/m5cvjmrtpjo71.gif|2||1632094665.0
23|Looking for a solid buy and hold? $ISEE might be the pick for you. Thank me later.|0|prhtr8|StockMarket|https://seekingalpha-com.cdn.ampproject.org/v/s/seekingalpha.com/amp/article/4455611-apellis-loss-iveric-bio-stock-gain-lucrative-eye-disease-field?amp_js_v=a6&amp_gsa=1&usqp=mq331AQKKAFQArABIIACAw%3D%3D#aoh=16319437280518&referrer=https%3A%2F%2Fwww.google.com&amp_tf=From%20%251%24s&ampshare=https%3A%2F%2Fseekingalpha.com%2Farticle%2F4455611-apellis-loss-iveric-bio-stock-gain-lucrative-eye-disease-field|1||1632089887.0
24|Calculating EPS on Yahoo Finance - What am I missing?|7|pr69mx|StockMarket|https://www.reddit.com/r/StockMarket/comments/pr69mx/calculating_eps_on_yahoo_finance_what_am_i_missing/|6|"This might be a dumb question or may have already been asked elsewhere but couldn't find it. I'm looking at Yahoo Finance's EPS they listed for their stocks. Let's take Tesla for example. The current ttm EPS they have listed is 1.90. Fair enough. When I take the ttm net income they have listed of 2,150,000,000 and divide it by the shares outstanding they have listed of 1B, this gives me an EPS of 2.15. Is this a rounding error or am I an idiot? I know fornsure both these figures are rounded figures.

Even it is a rounding error, would they not calculate the EPS from the very figures they are providing us? Rounded or otherwise?

Thanks in advance."|1632051132.0
