|title|score|id|subreddit|url|comments|selftext|created
9|Why I bought the dip on Berkeley Lights after that horrendous short report|2|prpplg|StockMarket|https://www.reddit.com/r/StockMarket/comments/prpplg/why_i_bought_the_dip_on_berkeley_lights_after/|3|"Disclosure: I recently opened a position in Berkeley Lights after that BS short 

Berkeley Lights operates a hi tech platform that separates cells that previously had to be analyzed and separated one at a time. The Beacon system is said to save upwards of two or three months in development for drug manufacturers, synthetic biology or any other company that needs to sort through large number of cells. This company was recently smeared with a nonsensical juvenile and stupid short report. Here I am focusing most on that report. 

The short report written by Scorpion Capital is a disgrace, before publishing it they released a series of tweets that sent the stock spiraling down. Using language like dumpster fire, fraud etc to attract attention very juvenile. I’m going to start with what they got wrong, and then what they got right, doing this because I want to expand on what they got wrong and if it’s correctable. 
So what they got wrong 
All of their customers are unhappy with the product and these companies were fleeced the thinking being that since these big pharma companies have so much cash they didn’t do any due diligence before hand. 
The claim itself is strange that Scorpion Capital without any expertise in genomics would be able to uncover something that these tech companies couldn’t have, and a lot of cash also means they are best positioned to be able to do the research and have the best access to outside experts as well. The idea that large successful companies don’t do any research and just purchase things without verification, that’s what failing companies do.  
Second ,we have some counter evidence. Two of the companies listed in the report said to have tried to return the equipment or to have not used it because it was either inefficient or too complicated to use have signed multi- year agreements with them recently. Those being Bayer and Thermo Fischer. Bayer being the company that tried two send it back of course that is just what “allegedly” happened, and we know now that is bs. 
So to believe the report you would have to believe that after first being fleeced the first time the company would then make the same error again but this time upping the agreement, but Scorpion Capital has uncovered something that they have no expertise that the best financed large companies could not. That is an awfully arrogant stance to have and a foolish one 
Analysts have also come out since then and refuted that, saying that they talked to four of their customers that said that it made them more efficient and saved time. Contradicting what was said by Scorpion capital. People are with good reason distrustful of analysts, but we have more transparency now than ever and sites like Tipranks tracks analysts accuracy. So we have one analyst coming out with a buy rating and another reaffirming a prior buy rating. First we have Doug Schenkel with a success rate of 71% with an average return of 33% with a buy rating after the report, and then we have Mark Massaro from BTIG covering the stock as well who reaffirmed his buy rating with a price target of $65 and his success rate is 62% with 24% accuracy. Both of these cover analysts cover life sciences and are considered five star analysts based on their success rate.  
Within the last month you have 3 buys and one hold. The one hold is from a 3 and a half star analyst with a 63% successful rating, but with only 40 calls made lacks experience as the other two I mentioned have well north of 200 calls made. He also called it a hold, but had a price target of $66 which is well over 100% upside. 
We also had Daniel Arias with a buy rating with a price target of 61 . Arias has a 77% accuracy thus with 86 calls with 66 of those being correct.  
 
 
Based on the 5 wall street analysts covering the stock over the stock over the past 12 months we have a 64-dollar price target representing a 136% upside from the current value. So, we put this up against Scorpion capital and they are once again saying that they have uncovered something that some of the best most accurate analysts and the largest Pharma companies could not. It’s an absurd ask. 

 
That gets me to my next point which I’m not going to detail every error, but it’s the most embarrassing part. This report is full of hearsay, false or misleading information and complaints that are from  from 2 to 3 years ago 
	Here is one example that is misleading and stupid. They show a headline featuring Zymergen and a huge decline in share price after CEO steps down. They are inferring here that BLI is a synthetic bio company which they are not, the machine can work with synthetic biology companies, it provides an instrument that can work with any cell-based company. It’s silly and stupid. Either they are too dumb to know the difference or they think the readers will be too dumb to know. It is deceitful either way, out of ignorance or more likely out of greed for their short position and the lack of factual evidence.  
 
They include in here like asking an anonymous person at Gingko whether they would invest in the company, and present that as evidence. The thing is they didn’t even report them as saying no.  
Leading us to wonder… I wonder what side they fell on.  
This is not research, it does not amount to anything concrete, and when someone is quoted something that is not negative, they frame it in that light. Interpreting people's responses in how they see fit. 
 

 
What they got right… Well, that is the obvious answer here it is the financials, and the complexity of the system, and the cost. They have a terrible EV/sale.  
The complexity of the system increases the learning curve to using it. I’m sure that all of you have had an experience at work where you were told that you needed to learn a new platform or tool, and there was a promise of this making you more productive more efficient. Except you were not more productive or more efficient right away. You were less efficient and less productive while you're learning how to operate the new system and then over time you're more efficient. The longer the learning curve the more time you are less efficient than you were when you were not using it, and that is likely to generate tremendous frustration. So that is on the company to make the software and system easier to use, simplify it.  
 
Second point- The financials. The revenue growth year over year for the quarter 2 was 82% and 56% increase over for the first half of year compared to 2020. The big revenue growth can be misleading given their poor performance in 2020. Some of this can be attributed to Covid and the reluctance of companies to invest in expensive capital during a pandemic, and the rest appears to be a mixture of poor execution and a very narrow revenue stream consisting solely of hardware sales for their instrument Beacon. They did develop some new use cases working with Bayer in crop science. They are committed to a 90 to 100 million end of year sales. I must mention Seeking Alpha has a quant system which is an algorithm that chooses stocks based on fundamentals and the company performs horribly and we can see why, it is expensive, it’s unprofitable, the return on common equity is negative 149% which is terrible. You hope they can differentiate and have more a diverse set of income streams. Fair point made, and a major weakness, and risk 
 
 
Third point that is valid is the beacon is expensive coming in at 2 million dollars. This means that at times of uncertainty you cut high capital costs like the Beacon. It is also priced out of the market for small and medium biotech companies. Large pharma like Pfizer do much less basic or fundamental research and instead purchase once that has been done, and there is less risk involved. The FDA process is tough, and you can derisk by buying after the potential medicine has been tested in early trials. You can pick the winners. Or you can sign a partnership like Pfizer did with BioNtech. So, who would benefit most from your product, and who could significantly decrease your reliance on large pharmaceutical companies is using a different strategy like a subscription service, or an equity deal or royalties which would be interesting. So I hope we get some more creativity to lower the upfront cost of Beacon so it’s more accessible.  
 
 
So that is it, what do I think of Berkeley Lights… 
Well, they offer a unique product without direct competition. When it has been implemented and the user is fluent in using it, it is a serious time saver. The short report makes relevant points about the financials, and the fact it was already going down, and their financials were poor, they had cover to write a very sloppy short report. I bought in at $20 would not buy over 20, and will keep it a limited part of my portfolio. It is a speculative high risk high reward. I also despise shorts  
 
https://www.youtube.com/watch?v=85hgH3C4RUQ&t=4s"|1632122090.0
10|How to Play the Current Market Drop|16|prdyem|StockMarket|https://www.reddit.com/r/StockMarket/comments/prdyem/how_to_play_the_current_market_drop/|46|"Several times this year **SPY** has broken through the lower end of its' upward sloping channel.  On 1/29, 3/4, 6/18, 7/19 the price fell below the SMA 50 on the daily chart, and closed below it.

Each time **SPY** bounced back the following day, reestablishing the 50 as a major line of support for the ETF.  After the next day closed above support, the market continued on to establish a new ATH.

Will that happen on Monday?  We will soon find out, but I certainly hope it doesn't.

If **SPY** continues to drop, it will be the first time this year that a break of major support had continuation.  At that point, 436 and 431.78 become the next two targets for a major breach.

Either way - *do not anticipate a move, wait for confirmation before acting on it.* In other words, don't start buying *calls* or going long on **/ES** futures thinking you can predict a bottom.  You can't.  It will become clear when **SPY** has established support and it's ready to rebound.

Here's what you should be doing though - making your list of stocks that are gaining strength ahead of **SPY**.  Stocks like **UPST, ETSY,** and **DASH** have all been pushing upwards during this market decline.   The next list should be of stocks that that are currently holding major support areas (**MSFT, FB,** and **AMZN** for example) - these stocks have been dragged down by a bearish market trend, but also have been able to hold support (unlike **AAPL** which broke through).

When **SPY** finally does finds support, this is your opportunity for some high probability trades.  An opportunity you do not want to waste by trying to get ahead of it.

This means that the first thing you will need to do is, *be patient*.  This is much harder to do than it sounds of course.  You'll see **SPY** bouncing back up and watching the stocks on your list bounce up with it.  At this point you might think, ""I am missing it, I need to get in now!"".  *No you don't*.  Wait.  Make sure the market isn't just chopping around, and then getting ready for another leg down. Much like it did from Monday - Thursday of last week.

When the market finally begins to reverse it will be clear - and it is at this point you want to start putting on Put Credit Spreads, Call Debit Spreads, Straight Calls, and Long Stock among those tickers you have been watching.  For example - let's say the market continues to drop and heads down to 431 (SMA 100), where it stabilizes and then begins to bounce back upwards.  At the same point you notice that **AMZN** is resting on it's SMA 100 around 3400.  As the market starts to go back up, so will **AMZN**, most likely recapturing its SMA 50 (3450).  You could do a Put Credit Spread of 3395/3390 for 3 weeks out and probably get a credit of roughly $1.50 for it, which is a 43% ROI.  You'll have two major lines of support above your short strike, giving you a lot of cushion on this trade.  You could also do a Call Debit Spread ATM of 3455/3460 for a debit under $2.50, as well.  Your risk is defined by your debit, which is less than 50% of the distance in the strike prices.

Perhaps **MSFT** dropped down to $292, right on its SMA 50, and is also showing Relative Strength to **SPY** \- if so you can do a one month out ITM calls with a delta of .7 or higher (probably a strike around $270).

Make sure you aren't too heavy into any single sector, and you have stocks like **MCD** and **AMAT** in your list as well.

What you want is to have several bullish plays ready to go across various sectors, and when you see **SPY** once again push upwards, you should be aggressively pulling the trigger on these trades.  *Again - not until you have confirmed that* ***SPY*** *has found support.*

Drops like these provide the best buying opportunities but so often people are either unprepared for them or jump in too early.  Last Thursday (9/16), I saw many traders assume that the drop was over given the previous pattern on **SPY** and as such they started executing a number of bullish swing trades, including Calls on **SPY**.  Needless to say, on Friday their accounts took a serious hit.  Why?  Because **SPY** did not confirm a reversal, just consolidation.

There are several areas of horizontal support/resistance for **SPY**,  downward sloping trendlines you can draw on the daily chart, and major SMA's to guide you - it should not be unclear to anyone when **SPY** reverses.  On Thursday, the market breached none of these lines - so there was no reason to get bullish on it.

Obviously these drops provide excellent Day Trading opportunities - on Friday for example, **ZM** began to go up around noon (est) as **SPY** continued to chop around, indicating Relative Strength to the market.  At 2pm (est), that strength is confirmed with **SPY** dropping and **ZM** holding its' bid.  That ticker provided several excellent *Day Trading* entries and exits throughout the day.  **UPST** and **ETSY** were similar.  In fact, days that **SPY** is bearish give you the best insight into stocks that are strong against the market and ready to really go once that get a tailwind behind them.

Many short-term traders shy away from price action like this on **SPY** and that would be a mistake.  *Day Trade* these drops with strong stocks, *Swing Trade* the reversal with high probability option plays.

\*Obviously you can and should *Day Trade* the reversal as well, but that is just a matter of looking for RS/RW as **SPY** is rebounding.

\*\*Also note that when I refer to Relative Strength I am not talking about RSI or Beta.  There are several posts on RS/RW in r/RealDayTrading and in my post history if you are curious.

TL;DR - These market drops provide the best *swing* and *day* trading opportunities, don't let them pass you by."|1632077519.0
11|Compound interest is very essential in making investments|5203|pqktq7|StockMarket|https://i.redd.it/po4gxic409o71.jpg|748||1631964939.0
